{
  "name": "gyokuro06-claude-code-plugins",
  "version": "0.1.0",
  "description": "Personal skill and command library for Claude Code",
  "author": {
    "name": "gyokuro06",
    "url": "https://github.com/gyokuro06"
  },
  "repository": "https://github.com/gyokuro06/claude-code-plugins",
  "license": "MIT",
  "keywords": ["claude-code", "skills", "commands", "personal"],
  "skills": [],
  "commands": [],
  "features": {
    "agents": 0,
    "commands": 0,
    "skills": 0
  }
}
